Country,Comments,lower_comments,character,rovio,crash,frustrat,disapp,hat,n't,wait,annoy,sham,proble,waste,ruin,terrible,delet,uninstall,bad,rubbish,garbage,junk,crap,not,sum_1,negative
AU,Game is really polished but with fremium and the arena leaderboard bugged its hard to keep me interested. I was coming first in my leaderboard and gave me only 10 feathers.,game is really polished but with fremium and the arena leaderboard bugged its hard to keep me interested. i was coming first in my leaderboard and gave me only 10 feathers.,172,0,0,0,0,0,0,0,0,0,0,0,0,0,0,0,0,0,0,0,0,0,0,0
AU,Better then the first,better then the first,21,0,0,0,0,0,0,0,0,0,0,0,0,0,0,0,0,0,0,0,0,0,0,0
AU,Fun game but if buying lives is now involved to play consider me no l You have lost me,fun game but if buying lives is now involved to play consider me no l you have lost me,86,0,0,0,0,0,0,0,0,0,0,0,0,0,0,0,0,0,0,0,0,0,0,0
AU,This game could be great but the greedy monetary system ruined the game for me and I refuse to play. I'd happily pay $10 for a complete game free from in-game purchases. Failure of a game.,this game could be great but the greedy monetary system ruined the game for me and i refuse to play. i'd happily pay $10 for a complete game free from in-game purchases. failure of a game.,188,0,0,0,0,0,0,0,0,0,0,0,1,0,0,0,0,0,0,0,0,0,1,1
AU,Good game but fix the glitch when u get in a level the game glitches.,good game but fix the glitch when u get in a level the game glitches.,69,0,0,0,0,0,0,0,0,0,0,0,0,0,0,0,0,0,0,0,0,0,0,0
AU,"Really dislike the lives concept and the changes (different birds, more difficult challenge) if I reset to have another go. Would rather pay up front and play for as long as I like with exactly the same challenge any time I like. Prefer the previous games and will not be spending real time or money on this one, it's annoying - graphics work is fabulous.","really dislike the lives concept and the changes (different birds, more difficult challenge) if i reset to have another go. would rather pay up front and play for as long as i like with exactly the same challenge any time i like. prefer the previous games and will not be spending real time or money on this one, it's annoying - graphics work is fabulous.",355,0,0,0,0,0,0,0,1,0,0,0,0,0,0,0,0,0,0,0,0,1,2,1
AU,Much better details,much better details,19,0,0,0,0,0,0,0,0,0,0,0,0,0,0,0,0,0,0,0,0,0,0,0
AU,This is one of the best new additions to the diverse  angrybirds games for a long time BUT it is too expensive guys. I love it but I doubt you'll keep people playing for long AND I only say this as it's one of the best new additions to the family for a long time. You've shot yourselves in the foot with a great new game out of greed. I will not be buying anymore new  angrybirds games  :(,this is one of the best new additions to the diverse  angrybirds games for a long time but it is too expensive guys. i love it but i doubt you'll keep people playing for long and i only say this as it's one of the best new additions to the family for a long time. you've shot yourselves in the foot with a great new game out of greed. i will not be buying anymore new  angrybirds games  :(,389,0,0,0,0,0,0,0,0,0,0,0,0,0,0,0,0,0,0,0,0,1,1,1
AU,Bad,bad,3,0,0,0,0,0,0,0,0,0,0,0,0,0,0,0,1,0,0,0,0,0,1,1
AU,"Plays well, nice glossy graphics & gameplay","plays well, nice glossy graphics & gameplay",43,0,0,0,0,0,0,0,0,0,0,0,0,0,0,0,0,0,0,0,0,0,0,0
AU,Love this. It's just as great as when the first ever  angrybirds came out,love this. it's just as great as when the first ever  angrybirds came out,73,0,0,0,0,0,0,0,0,0,0,0,0,0,0,0,0,0,0,0,0,0,0,0
AU,so funny & nice graphic animation,so funny & nice graphic animation,33,0,0,0,0,0,0,0,0,0,0,0,0,0,0,0,0,0,0,0,0,0,0,0
AU,"You greedy horrible company. You're so desperate for money that you've brought in a 'lives' system. I wanted to buy the game so that I could get proficient at each level, but now I am limited to whatever 'lives' you give me. And I'm not going to buy lots of 'lives' from you. So after I've posted this review I will delete  angrybirds 2. And eventually you'll change your greedy ways, or (if everyone does what I do), you'll go out of business. Goodbye old friend. We had some great times together.","you greedy horrible company. you're so desperate for money that you've brought in a 'lives' system. i wanted to buy the game so that i could get proficient at each level, but now i am limited to whatever 'lives' you give me. and i'm not going to buy lots of 'lives' from you. so after i've posted this review i will delete  angrybirds 2. and eventually you'll change your greedy ways, or (if everyone does what i do), you'll go out of business. goodbye old friend. we had some great times together.",498,0,0,0,0,1,0,0,0,0,0,0,0,0,1,0,0,0,0,0,0,1,3,1
AU,Great fun game and just as addictive as the first one !!,great fun game and just as addictive as the first one !!,56,0,0,0,0,0,0,0,0,0,0,0,0,0,0,0,0,0,0,0,0,0,0,0
AU,"It's just like the first one but with some new features added, quite enjoying myself playing it","it's just like the first one but with some new features added, quite enjoying myself playing it",95,0,0,0,0,0,0,0,0,0,0,0,0,0,0,0,0,0,0,0,0,0,0,0
AU,nothing new,nothing new,11,0,0,0,0,0,0,0,0,0,0,0,0,0,0,0,0,0,0,0,0,1,1,1
AU,Delete this game,delete this game,16,0,0,0,0,0,0,0,0,0,0,0,0,0,1,0,0,0,0,0,0,0,1,1
AU,Classic pay to play. By no means download this app it's a waste it does not even let you properly  play the game.,classic pay to play. by no means download this app it's a waste it does not even let you properly  play the game.,113,0,0,0,0,0,0,0,0,0,0,1,0,0,0,0,0,0,0,0,0,1,2,1
AU,Good,good,4,0,0,0,0,0,0,0,0,0,0,0,0,0,0,0,0,0,0,0,0,0,0,0
AU,Nice step forward from the last game; new level/lives system might annoy the hard core players.,nice step forward from the last game; new level/lives system might annoy the hard core players.,95,0,0,0,0,0,0,0,1,0,0,0,0,0,0,0,0,0,0,0,0,0,1,1
AU,Keeps closing down on my iPad,keeps closing down on my ipad,29,0,0,0,0,0,0,0,0,0,0,0,0,0,0,0,0,0,0,0,0,0,0,0
AU,Would be nice if the whole thing would not shut down every time I try to play,would be nice if the whole thing would not shut down every time i try to play,77,0,0,0,0,0,0,0,0,0,0,0,0,0,0,0,0,0,0,0,0,1,1,1
AU,Love it. Best one yet,love it. best one yet,21,0,0,0,0,0,0,0,0,0,0,0,0,0,0,0,0,0,0,0,0,0,0,0
AU,grate game much better than the first one out,grate game much better than the first one out,45,0,0,0,0,0,0,0,0,0,0,0,0,0,0,0,0,0,0,0,0,0,0,0
AU,"Great game, no doubt about it. But there is one thing I do not like about it, that is the fact that you have lives. I hate this addition to the game. It's so annoying when you want to restart a level and it takes away s life. There is more I can say but I'll leave it at that. I think there should be an update that removes the lives system from the game.","great game, no doubt about it. but there is one thing i do not like about it, that is the fact that you have lives. i hate this addition to the game. it's so annoying when you want to restart a level and it takes away s life. there is more i can say but i'll leave it at that. i think there should be an update that removes the lives system from the game.",355,0,0,0,0,1,0,0,1,0,0,0,0,0,0,0,0,0,0,0,0,1,3,1
AU,"Okay Rovio, this is one heck of a masterpiece. But there is a few things that really ruin the game!! Okay do not even get me started on those stupid lives, just do yourself a favour and take them out, also I play on an iPad mini and it crashes about.. Like every five minuets, and also what I find annoying is that u have to have an Internet connection, I mean I want to be able to play when I'm in the car or when I'm out pls Rovio I hope u get this message and add some changes pls. Thank you for this great game ,","okay rovio, this is one heck of a masterpiece. but there is a few things that really ruin the game!! okay do not even get me started on those stupid lives, just do yourself a favour and take them out, also i play on an ipad mini and it crashes about.. like every five minuets, and also what i find annoying is that u have to have an internet connection, i mean i want to be able to play when i'm in the car or when i'm out pls rovio i hope u get this message and add some changes pls. thank you for this great game ,",516,1,1,0,0,1,0,0,1,0,0,0,1,0,0,0,0,0,0,0,0,1,6,1
AU, angrybirds 2 is an amazing sequel to an already amazing game., angrybirds 2 is an amazing sequel to an already amazing game.,62,0,0,0,0,0,0,0,0,0,0,0,0,0,0,0,0,0,0,0,0,0,0,0
AU,I like it,i like it,9,0,0,0,0,0,0,0,0,0,0,0,0,0,0,0,0,0,0,0,0,0,0,0
AU,I do not enjoy the new format or the interface. Played two levels and deleted it.,i do not enjoy the new format or the interface. played two levels and deleted it.,81,0,0,0,0,0,0,0,0,0,0,0,0,0,1,0,0,0,0,0,0,1,2,1
AU,pathetic exploitative f2p at it's worst.,pathetic exploitative f2p at it's worst.,40,0,0,0,0,0,0,0,0,0,0,0,0,0,0,0,0,0,0,0,0,0,0,0
AU,"Each time I play the first level, it is loading, then it crashes. Just like that! Please make a bug update, Rovio.","each time i play the first level, it is loading, then it crashes. just like that! please make a bug update, rovio.",114,1,1,0,0,1,0,0,0,0,0,0,0,0,0,0,0,0,0,0,0,0,3,1
AU, angrybirds 2 is great and all until... BAM! That one stage you can not beat. Got me frustrated but is still fun. I would recommend the game if you do not get frustrated like me. :), angrybirds 2 is great and all until... bam! that one stage you can not beat. got me frustrated but is still fun. i would recommend the game if you do not get frustrated like me. :),181,0,0,1,0,1,0,0,0,0,0,0,0,0,0,0,0,0,0,0,0,1,3,1
AU,I would say something about this game but it will not load the first level on my iPad mini and I'm angry because it took forever to load now I can even play it and I want someone to fix it because I love  angrybirds,i would say something about this game but it will not load the first level on my ipad mini and i'm angry because it took forever to load now i can even play it and i want someone to fix it because i love  angrybirds,215,0,0,0,0,0,0,0,0,0,0,0,0,0,0,0,0,0,0,0,0,1,1,1
AU,"Same fun gameplay, whored out for another dollar with the lives bull.   Seriously guys, make it a dollar to buy the full game and you get your customers back.","same fun gameplay, whored out for another dollar with the lives bull.   seriously guys, make it a dollar to buy the full game and you get your customers back.",158,0,0,0,0,0,0,0,0,0,0,0,0,0,0,0,0,0,0,0,0,1,1,1
AU,"Why fix what was not broken? This is nowhere near as fun or exciting as the original. There is no skill required, and it's more about silly bouncing graphics than actual game play. No thanks Rovio. I'll be deleting this now.","why fix what was not broken? this is nowhere near as fun or exciting as the original. there is no skill required, and it's more about silly bouncing graphics than actual game play. no thanks rovio. i'll be deleting this now.",224,1,0,0,0,1,0,0,0,0,0,0,0,0,1,0,0,0,0,0,0,1,4,1
AU,Another great time wasting game! Thank you!,another great time wasting game! thank you!,43,0,0,0,0,0,0,0,0,0,0,0,0,0,0,0,0,0,0,0,0,1,1,1
AU,The game is ruined,the game is ruined,18,0,0,0,0,0,0,0,0,0,0,0,1,0,0,0,0,0,0,0,0,0,1,1
AU,Awesome!!!!!!!!!!!!,awesome!!!!!!!!!!!!,19,0,0,0,0,0,0,0,0,0,0,0,0,0,0,0,0,0,0,0,0,0,0,0
AU,"You liked a game ... you bought it.  Once.  Forever.  It inspired mastery and made the good games (as  angrybirds once was) massively replay-able.  Vale good gameplay.  You are immediately taken out of the game with the incessant demand for $$.  Whatever novel gameplay is in this latest release is completely undone by the constant need for gems.  You can not even replay a level without penalty.    The users are treated like sheep .... Either keep reaching into your pocket, or watch our tedious ads for other products you have absolutely no interest or intent to buy.  I w","you liked a game ... you bought it.  once.  forever.  it inspired mastery and made the good games (as  angrybirds once was) massively replay-able.  vale good gameplay.  you are immediately taken out of the game with the incessant demand for $$.  whatever novel gameplay is in this latest release is completely undone by the constant need for gems.  you can not even replay a level without penalty.    the users are treated like sheep .... either keep reaching into your pocket, or watch our tedious ads for other products you have absolutely no interest or intent to buy.  i w",576,0,0,0,0,1,0,0,0,0,0,0,0,0,0,0,0,0,0,0,0,1,2,1
AU,"I have not even played the game and I'm angry with it already! Every time i press the app i have to wait like 10 minutes for it to load half way then when it does load halfway it says \check your internet connection.\"" Plus by looking at the reviews so far the game does not even sound that good so i have to day Rovio you've had better way better. Im very disappointed.""","i have not even played the game and i'm angry with it already! every time i press the app i have to wait like 10 minutes for it to load half way then when it does load halfway it says \check your internet connection.\"" plus by looking at the reviews so far the game does not even sound that good so i have to day rovio you've had better way better. im very disappointed.""",371,1,0,0,1,1,0,1,0,0,0,0,0,0,0,0,0,0,0,0,0,1,5,1
AU,It's an ok sequel. I find it runs fairly sluggish on iPad Air. Think I'll play the original again,it's an ok sequel. i find it runs fairly sluggish on ipad air. think i'll play the original again,97,0,0,0,0,0,0,0,0,0,0,0,0,0,0,0,0,0,0,0,0,0,0,0
AU,This says it is new but it came out ages ago I had it a long time ago like March 2015,this says it is new but it came out ages ago i had it a long time ago like march 2015,85,0,0,0,0,0,0,0,0,0,0,0,0,0,0,0,0,0,0,0,0,0,0,0
AU,I love it,i love it,9,0,0,0,0,0,0,0,0,0,0,0,0,0,0,0,0,0,0,0,0,0,0,0
AU,"Yes, they need money to feed themselves, yes they make games because they need money. No, this life system is not very good. Other than that, everything seems to be good.","yes, they need money to feed themselves, yes they make games because they need money. no, this life system is not very good. other than that, everything seems to be good.",170,0,0,0,0,1,0,0,0,0,0,0,0,0,0,0,0,0,0,0,0,1,2,1
AU,easy than before?but more fun,easy than before?but more fun,29,0,0,0,0,0,0,0,0,0,0,0,0,0,0,0,0,0,0,0,0,0,0,0
AU,"This game is brutal, yet kinky at the same time. I love the fear in the pigs eyes before they die, it fills my sick fantasys.","this game is brutal, yet kinky at the same time. i love the fear in the pigs eyes before they die, it fills my sick fantasys.",125,0,0,0,0,0,0,0,0,0,0,0,0,0,0,0,0,0,0,0,0,0,0,0
AU,Rekindled my addiction for this game!!,rekindled my addiction for this game!!,38,0,0,0,0,0,0,0,0,0,0,0,0,0,0,0,0,0,0,0,0,0,0,0
AU,Terrible terrible terrible terrible terrible terrible terrible terrible terrible terrible terrible terrible,terrible terrible terrible terrible terrible terrible terrible terrible terrible terrible terrible terrible,107,0,0,0,0,0,0,0,0,0,0,0,0,1,0,0,0,0,0,0,0,0,1,1
AU,"Nice game for normal people who do not expect the sky out of an app. If u enjoyed angrybirds 1, you may like this. Life's are the down side but it's alright.","nice game for normal people who do not expect the sky out of an app. if u enjoyed angrybirds 1, you may like this. life's are the down side but it's alright.",157,0,0,0,0,0,0,0,0,0,0,0,0,0,0,0,0,0,0,0,0,1,1,1
AU,Great game,great game,10,0,0,0,0,0,0,0,0,0,0,0,0,0,0,0,0,0,0,0,0,0,0,0
AU,Great,great,5,0,0,0,0,0,0,0,0,0,0,0,0,0,0,0,0,0,0,0,0,0,0,0
AU,do not bother with this 'new' version. Same game only now you get 5 lives & have to wait for the lives to reset. Definitely going to delete it.   Deserves a zero.,do not bother with this 'new' version. same game only now you get 5 lives & have to wait for the lives to reset. definitely going to delete it.   deserves a zero.,162,0,0,0,0,0,0,1,0,0,0,0,0,0,1,0,0,0,0,0,0,1,3,1
AU,Cool,cool,4,0,0,0,0,0,0,0,0,0,0,0,0,0,0,0,0,0,0,0,0,0,0,0
AU,Ever since I updated to  angrybirds 2 it will not work now ..awesome,ever since i updated to  angrybirds 2 it will not work now ..awesome,68,0,0,0,0,0,0,0,0,0,0,0,0,0,0,0,0,0,0,0,0,1,1,1
AU,I really love the new version of my favorite game. Keeps me busy for hours!,i really love the new version of my favorite game. keeps me busy for hours!,75,0,0,0,0,0,0,0,0,0,0,0,0,0,0,0,0,0,0,0,0,0,0,0
AU,Brilliant.,brilliant.,10,0,0,0,0,0,0,0,0,0,0,0,0,0,0,0,0,0,0,0,0,0,0,0
AU,The only issue is you cannot avoid the tutorials. Oh and the sudden inclusion of lots of requests to spend money . . . Hmmmmm,the only issue is you cannot avoid the tutorials. oh and the sudden inclusion of lots of requests to spend money . . . hmmmmm,125,0,0,0,0,0,0,0,0,0,0,0,0,0,0,0,0,0,0,0,0,1,1,1
AU,Awsome game love  angrybirds great work guys,awsome game love  angrybirds great work guys,44,0,0,0,0,0,0,0,0,0,0,0,0,0,0,0,0,0,0,0,0,0,0,0
AU,Thanks Rovio for another installment on  angrybirds. Love the new animations and graphics. Dissapointed at the 'lives' that you have to use & wait to move on. *sigh* gone are the days where a free game is just a free game.,thanks rovio for another installment on  angrybirds. love the new animations and graphics. dissapointed at the 'lives' that you have to use & wait to move on. *sigh* gone are the days where a free game is just a free game.,222,1,0,0,0,1,0,1,0,0,0,0,0,0,0,0,0,0,0,0,0,1,4,1
AU,Wicked game,wicked game,11,0,0,0,0,0,0,0,0,0,0,0,0,0,0,0,0,0,0,0,0,0,0,0
AU,"The gameplay is way over considered. It's just a repeat of number one... Except with all the money makers included. What I was looking for was a sequel... Something new, unique and fun... But with the same awesome simplicity of the original. Not a cash grab wrapped in fancy graphics.","the gameplay is way over considered. it's just a repeat of number one... except with all the money makers included. what i was looking for was a sequel... something new, unique and fun... but with the same awesome simplicity of the original. not a cash grab wrapped in fancy graphics.",284,0,0,0,0,1,0,0,0,0,0,0,0,0,0,0,0,0,0,0,0,1,2,1
AU,"I would prefer it to cost $1, but have less ads and other tools to force you pay money","i would prefer it to cost $1, but have less ads and other tools to force you pay money",86,0,0,0,0,0,0,0,0,0,0,0,0,0,0,0,0,0,0,0,0,0,0,0
AU,"Miss the old  angrybirds, where you could retry and retry until you got perfect scores. This new game is evidently focused on revenue earning for them. Nothing special.","miss the old  angrybirds, where you could retry and retry until you got perfect scores. this new game is evidently focused on revenue earning for them. nothing special.",168,0,0,0,0,0,0,0,0,0,0,0,0,0,0,0,0,0,0,0,0,1,1,1
AU,Simply love it,simply love it,14,0,0,0,0,0,0,0,0,0,0,0,0,0,0,0,0,0,0,0,0,0,0,0
AU,This game crashes on iPad mini can not even play 1 level fix and I'll give 5 stars,this game crashes on ipad mini can not even play 1 level fix and i'll give 5 stars,82,0,1,0,0,0,0,0,0,0,0,0,0,0,0,0,0,0,0,0,0,1,2,1
AU,could not they just charge money for the game and make the continues similar to the first one? I'll be uninstalling this game soon as I am done with this review. It's a shame because the game seems like heaps of fun (except for having to beat two rooms with one set of birds). Oh well ??,could not they just charge money for the game and make the continues similar to the first one? i'll be uninstalling this game soon as i am done with this review. it's a shame because the game seems like heaps of fun (except for having to beat two rooms with one set of birds). oh well ??,287,0,0,0,0,0,0,0,0,1,0,0,0,0,0,1,0,0,0,0,0,1,3,1
AU,It's pretty good but not a fan of limited restarts good for a challenge though.,it's pretty good but not a fan of limited restarts good for a challenge though.,79,0,0,0,0,0,0,0,0,0,0,0,0,0,0,0,0,0,0,0,0,1,1,1
AU,"Great game, Until you hit the pay to play wall... Very sad.  They try to get you to rate the game before you hit it. do not be fooled, play a bit longer, and then rate the game.","great game, until you hit the pay to play wall... very sad.  they try to get you to rate the game before you hit it. do not be fooled, play a bit longer, and then rate the game.",177,0,0,0,0,0,0,0,0,0,0,0,0,0,0,0,0,0,0,0,0,1,1,1
AU,"The game is great, a true sequel to a classic, the only thing that ruined the experience for me is the lives system, if you get stuck on a level, you're waiting almost 20 minutes for your lives to refresh, just so you can play again, removing this feature and bringing back the good ol reset button would make the game flawless","the game is great, a true sequel to a classic, the only thing that ruined the experience for me is the lives system, if you get stuck on a level, you're waiting almost 20 minutes for your lives to refresh, just so you can play again, removing this feature and bringing back the good ol reset button would make the game flawless",327,0,0,0,0,1,0,1,0,0,0,0,1,0,0,0,0,0,0,0,0,0,3,1
AU,Best game on the App Store,best game on the app store,26,0,0,0,0,0,0,0,0,0,0,0,0,0,0,0,0,0,0,0,0,0,0,0
AU,Runs slow on the iphone6. Cluttered interface. Intrusive monetization.,runs slow on the iphone6. cluttered interface. intrusive monetization.,70,0,0,0,0,0,0,0,0,0,0,0,0,0,0,0,0,0,0,0,0,0,0,0
AU," angrybirds 2!!! Yeah!!!! That's such an achievement but took forever. I want to talk about the loading times. It kills. I think by the time Rivio make  angrybirds 3, it MAY be the next level. I'm not sure though. Also I have an iPhone 5 but that did not stop  angrybirds crashing every time I tried to play the first level. I had to restart the phone. Otherwise not too bad Rivio, not too bad."," angrybirds 2!!! yeah!!!! that's such an achievement but took forever. i want to talk about the loading times. it kills. i think by the time rivio make  angrybirds 3, it may be the next level. i'm not sure though. also i have an iphone 5 but that did not stop  angrybirds crashing every time i tried to play the first level. i had to restart the phone. otherwise not too bad rivio, not too bad.",394,0,1,0,0,1,0,0,0,0,0,0,0,0,0,0,1,0,0,0,0,1,4,1
AU,"Played it for 15 min then deleted it, I refuse to pay for extra lives to play a game. You ruined it!","played it for 15 min then deleted it, i refuse to pay for extra lives to play a game. you ruined it!",100,0,0,0,0,0,0,0,0,0,0,0,1,0,1,0,0,0,0,0,0,0,2,1
AU,"I hate this 'having to buy gems' business model in order to play a game! Rovio should have an option to just buy the full game, without me having to deal with all this buying gems and getting lives, and getting free birds, and watching ads and the waiting to play... I would buy this for $2.99 -the game could be really great this way.","i hate this 'having to buy gems' business model in order to play a game! rovio should have an option to just buy the full game, without me having to deal with all this buying gems and getting lives, and getting free birds, and watching ads and the waiting to play... i would buy this for $2.99 -the game could be really great this way.",335,1,0,0,0,1,0,1,0,0,0,0,0,0,0,0,0,0,0,0,0,0,3,1
AU,"Love the game.. Had to wait 4 years.. Just Li,tied lives is annoying.","love the game.. had to wait 4 years.. just li,tied lives is annoying.",69,0,0,0,0,0,0,1,1,0,0,0,0,0,0,0,0,0,0,0,0,0,2,1
AU,still fun  good graphic,still fun  good graphic,23,0,0,0,0,0,0,0,0,0,0,0,0,0,0,0,0,0,0,0,0,0,0,0
AU,This game is what is wrong with mobile gaming. Get it together rovio.,this game is what is wrong with mobile gaming. get it together rovio.,69,1,0,0,0,1,0,0,0,0,0,0,0,0,0,0,0,0,0,0,0,0,2,1
AU,A good looking update with some interesting developments on the old mechanic. Be prepared to spend a little cash looking for the perfect high score though.,a good looking update with some interesting developments on the old mechanic. be prepared to spend a little cash looking for the perfect high score though.,155,0,0,0,0,0,0,0,0,0,0,0,0,0,0,0,0,0,0,0,0,0,0,0
AU,Nice design and interacting game,nice design and interacting game,32,0,0,0,0,0,0,0,0,0,0,0,0,0,0,0,0,0,0,0,0,0,0,0
AU,"it needs to be harder. we've all played the  angrybirds saga we get how it works through some challenges in there and definatley figure out something better to waste gems on. get rid of the lives and get a replay button happening, i love beating my high scores and lives drive me up the wall.","it needs to be harder. we've all played the  angrybirds saga we get how it works through some challenges in there and definatley figure out something better to waste gems on. get rid of the lives and get a replay button happening, i love beating my high scores and lives drive me up the wall.",292,0,0,0,0,0,0,0,0,0,0,1,0,0,0,0,0,0,0,0,0,0,1,1
AU,"fun, new look","fun, new look",13,0,0,0,0,0,0,0,0,0,0,0,0,0,0,0,0,0,0,0,0,0,0,0
AU,Love the art style and the cheeky new tweeks to the game. Would recommended.,love the art style and the cheeky new tweeks to the game. would recommended.,76,0,0,0,0,0,0,0,0,0,0,0,0,0,0,0,0,0,0,0,0,0,0,0
AU,"Like everyone else, Rovio has traded in the system that made them famous and now gone for an over the top, micro transaction piece of rubbish. do not get me wrong, it still has visual and playable appeal, but it's very limited unless you want to drop $$$ into it continuously. Deleting this one. Dissapointed. did not they learn from others flopping like plants vs zombies 2?","like everyone else, rovio has traded in the system that made them famous and now gone for an over the top, micro transaction piece of rubbish. do not get me wrong, it still has visual and playable appeal, but it's very limited unless you want to drop $$$ into it continuously. deleting this one. dissapointed. did not they learn from others flopping like plants vs zombies 2?",375,1,0,0,0,1,0,0,0,0,0,0,0,0,1,0,0,1,0,0,0,1,5,1
