Country,Comments,lower_comments,character,rovio,crash,frustrat,disapp,hat,n't,wait,annoy,sham,proble,waste,ruin,terrible,delet,uninstall,bad,rubbish,garbage,junk,crap,not,sum_1,negative
GB,Need more levels asap,need more levels asap,21,0,0,0,0,0,0,0,0,0,0,0,0,0,0,0,0,0,0,0,0,0,0,0
GB,This is a good update of the classic game. Well done.,this is a good update of the classic game. well done.,53,0,0,0,0,0,0,0,0,0,0,0,0,0,0,0,0,0,0,0,0,0,0,0
GB,The game frequently crashes on my iPad mini.  Most often between levels but now has starting mid level thus losing a life or if in the arena a potentially good score.  Come on Rovio - sort it out,the game frequently crashes on my ipad mini.  most often between levels but now has starting mid level thus losing a life or if in the arena a potentially good score.  come on rovio - sort it out,195,1,1,0,0,0,0,0,0,0,0,0,0,0,0,0,0,0,0,0,0,0,2,1
GB,"can not see why people are slating this, if you lose all your lives you're either rubbish or have too much spare time! If you can not wait to get news lives then you really need to get out more, it's not that long. I've enjoyed the game and about 1/2 the way through! Some levels are challenging others are pop! Enjoying it and highly recommend","can not see why people are slating this, if you lose all your lives you're either rubbish or have too much spare time! if you can not wait to get news lives then you really need to get out more, it's not that long. i've enjoyed the game and about 1/2 the way through! some levels are challenging others are pop! enjoying it and highly recommend",344,0,0,0,0,1,0,1,0,0,0,0,0,0,0,0,0,1,0,0,0,1,4,1
GB,^exactly this. Update please.,^exactly this. update please.,29,0,0,0,0,0,0,0,0,0,0,0,0,0,0,0,0,0,0,0,0,0,0,0
GB,"I saw all of the bad reviews so I thought what's this all about, downloaded it would not even start without crashing. I do not know much about the developers of this game but for the future, do not waste my time.","i saw all of the bad reviews so i thought what's this all about, downloaded it would not even start without crashing. i do not know much about the developers of this game but for the future, do not waste my time.",212,0,1,0,0,1,0,0,0,0,0,1,0,0,0,0,1,0,0,0,0,1,5,1
GB,"Good game, However the amount of life's you receive every half an hour has been reduced significantly from 5 life's every half an hour to 3 life's every hour. I noticed this recently after the latest update had finished, therefor since the update has taken place I have barely played on   angrybirds due to the lack of life's you receive.","good game, however the amount of life's you receive every half an hour has been reduced significantly from 5 life's every half an hour to 3 life's every hour. i noticed this recently after the latest update had finished, therefor since the update has taken place i have barely played on   angrybirds due to the lack of life's you receive.",338,0,0,0,0,0,0,0,0,0,0,0,0,0,0,0,0,0,0,0,0,1,1,1
GB,"What I've play was ok not great to be honest all felt like a \training\"" game not really lived up to expectations! The crashing out after every few levels was annoying but now loads soooo slowly then soon as u select level to play crashes out. At point of giving up and deleting it!""","what i've play was ok not great to be honest all felt like a \training\"" game not really lived up to expectations! the crashing out after every few levels was annoying but now loads soooo slowly then soon as u select level to play crashes out. at point of giving up and deleting it!""",283,0,1,0,0,1,0,0,1,0,0,0,0,0,1,0,0,0,0,0,0,1,5,1
GB,Miles better than the original,miles better than the original,30,0,0,0,0,0,0,0,0,0,0,0,0,0,0,0,0,0,0,0,0,0,0,0
GB,I was a fan of the original game and the many spinoffs. The space version introduced rotating gravity which added immensely to to the gameplay.  angrybirds two was the next logical progression. I'm not sure I like the idea of the it being made into a micro pay saga but only time will tell,i was a fan of the original game and the many spinoffs. the space version introduced rotating gravity which added immensely to to the gameplay.  angrybirds two was the next logical progression. i'm not sure i like the idea of the it being made into a micro pay saga but only time will tell,289,0,0,0,0,0,0,0,0,0,0,0,0,0,0,0,0,0,0,0,0,1,1,1
GB,Xbcxbkufcbmkfxcbkufd c  Nuff Said,xbcxbkufcbmkfxcbkufd c  nuff said,33,0,0,0,0,0,0,0,0,0,0,0,0,0,0,0,0,0,0,0,0,0,0,0
GB,The game is great but every time i finish a level and go on to play the next the app always crushes and i still cant play the game after i re-enter the app.,the game is great but every time i finish a level and go on to play the next the app always crushes and i still cant play the game after i re-enter the app.,156,0,0,0,0,0,0,0,0,0,0,0,0,0,0,0,0,0,0,0,0,0,0,0
GB,Awesome,awesome,7,0,0,0,0,0,0,0,0,0,0,0,0,0,0,0,0,0,0,0,0,0,0,0
GB,Awesome,awesome,7,0,0,0,0,0,0,0,0,0,0,0,0,0,0,0,0,0,0,0,0,0,0,0
GB,"This is a really addicting, fun game which does not seem to run out of energy too quickly. I think the people who have given 1 star are wrong!","this is a really addicting, fun game which does not seem to run out of energy too quickly. i think the people who have given 1 star are wrong!",142,0,0,0,0,0,0,0,0,0,0,0,0,0,0,0,0,0,0,0,0,1,1,1
GB,"interesting evoltion and new features but commercial stuff irritating - biggest moan?.. its real slow, even on a top of the line iphone and great connection speed - can not be bothered","interesting evoltion and new features but commercial stuff irritating - biggest moan?.. its real slow, even on a top of the line iphone and great connection speed - can not be bothered",184,0,0,0,0,0,0,0,0,0,0,0,0,0,0,0,0,0,0,0,0,1,1,1
GB,Normally I delete games because I got bored of them. I deleted this because it's just a blatant attempt to screw money out of you. I do not know how it shows as having the star rating it does. It seems like a fix.,normally i delete games because i got bored of them. i deleted this because it's just a blatant attempt to screw money out of you. i do not know how it shows as having the star rating it does. it seems like a fix.,213,0,0,0,0,0,0,0,0,0,0,0,0,0,1,0,0,0,0,0,0,1,2,1
GB,So yeah this update has made things a little better (e.g) using less gems as payment for some things but where have my 5 lives gone that took about half hour to refill?? Now yours stuck with 3 lives and have to wait an hour for each one to be refilled!! Starting to lose interest in this game now because what's the point of playing when it's game over after 3 goes!! I always thought with  angrybirds your could just refresh and have another go!! Oh how the times have changed and Rovio are more interested in making money than making a good quality game ..disappointed,so yeah this update has made things a little better (e.g) using less gems as payment for some things but where have my 5 lives gone that took about half hour to refill?? now yours stuck with 3 lives and have to wait an hour for each one to be refilled!! starting to lose interest in this game now because what's the point of playing when it's game over after 3 goes!! i always thought with  angrybirds your could just refresh and have another go!! oh how the times have changed and rovio are more interested in making money than making a good quality game ..disappointed,570,1,0,0,1,1,0,1,0,0,0,0,0,0,0,0,0,0,0,0,0,1,5,1
GB,I love when developers listen to nothing players are saying and destroy their own franchise with a free to play model. This game is ruined,i love when developers listen to nothing players are saying and destroy their own franchise with a free to play model. this game is ruined,138,0,0,0,0,0,0,0,0,0,0,0,1,0,0,0,0,0,0,0,0,1,2,1
GB,"Downloaded this morning and so far have had 6 attempts to get on the game and it's crashed five of those, I've managed two games and will be deleting.","downloaded this morning and so far have had 6 attempts to get on the game and it's crashed five of those, i've managed two games and will be deleting.",150,0,1,0,0,0,0,0,0,0,0,0,0,0,1,0,0,0,0,0,0,0,2,1
GB,Take it with comfidence,take it with comfidence,23,0,0,0,0,0,0,0,0,0,0,0,0,0,0,0,0,0,0,0,0,0,0,0
GB,"do not even bother with this version. Seems greed has ruined  angrybirds... Yeah it looks good and it's fun - up to a point - to play. But I'm fairly sure you can not get very far without having to spend either money, or time, watching ads for games that I'll definitely never download to reach the next level. Why not just be honest, and charge for the game to begin with? I'm sure most people would prefer to pay a few quid up front, and not be constantly bombarded with adverts. Uninstalled.","do not even bother with this version. seems greed has ruined  angrybirds... yeah it looks good and it's fun - up to a point - to play. but i'm fairly sure you can not get very far without having to spend either money, or time, watching ads for games that i'll definitely never download to reach the next level. why not just be honest, and charge for the game to begin with? i'm sure most people would prefer to pay a few quid up front, and not be constantly bombarded with adverts. uninstalled.",494,0,0,0,0,1,0,0,0,0,0,0,1,0,0,1,0,0,0,0,0,1,4,1
GB,"Rovio are DONE. This game is the final insult to us, the customers, to whom (they seem to have forgotten) they owe everything.   Ridiculous in-app purchases that could cost a fortune if you let them.   Do yourself a favour; stick with the original.  angrybirds 2 is not a patch on it.","rovio are done. this game is the final insult to us, the customers, to whom (they seem to have forgotten) they owe everything.   ridiculous in-app purchases that could cost a fortune if you let them.   do yourself a favour; stick with the original.  angrybirds 2 is not a patch on it.",284,1,0,0,0,1,0,0,0,0,0,0,0,0,0,0,0,0,0,0,0,1,3,1
GB,Just downloaded this to my iPod but does not even load the game as soon as you press the level one it crashes. Checked back in app stores seems like everyone is experiencing the same problem. Most disappointed as I love angry  birds!!,just downloaded this to my ipod but does not even load the game as soon as you press the level one it crashes. checked back in app stores seems like everyone is experiencing the same problem. most disappointed as i love angry  birds!!,234,0,1,0,1,0,0,0,0,0,1,0,0,0,0,0,0,0,0,0,0,1,4,1
GB,Really like this game however ive already finished playing and waiting for new update also i think when we win treasures there should be higher amount of feathers it will take forever to upgrade at this rate also i keep coming first on global player hahaha,really like this game however ive already finished playing and waiting for new update also i think when we win treasures there should be higher amount of feathers it will take forever to upgrade at this rate also i keep coming first on global player hahaha,256,0,0,0,0,0,0,1,0,0,0,0,0,0,0,0,0,0,0,0,0,0,1,1
GB,"Great improvement on the first game. I play every day, just waiting on more levels now :-)","great improvement on the first game. i play every day, just waiting on more levels now :-)",90,0,0,0,0,0,0,1,0,0,0,0,0,0,0,0,0,0,0,0,0,0,1,1
GB,"I loved the originals, this is horrible!  Since the update as well... Diabolical. I would pay for the old games but this I had to delete. Rovio, useless now.  AVOID AT ALL COSTS!","i loved the originals, this is horrible!  since the update as well... diabolical. i would pay for the old games but this i had to delete. rovio, useless now.  avoid at all costs!",178,1,0,0,0,0,0,0,0,0,0,0,0,0,1,0,0,0,0,0,0,0,2,1
GB,Noyce ????,noyce ????,10,0,0,0,0,0,0,0,0,0,0,0,0,0,0,0,0,0,0,0,0,0,0,0
GB,Takes ages between rounds with all the little animations. It seems they want to add every little animated sequence to this which makes the game slower.,takes ages between rounds with all the little animations. it seems they want to add every little animated sequence to this which makes the game slower.,151,0,0,0,0,0,0,0,0,0,0,0,0,0,0,0,0,0,0,0,0,0,0,0
GB,Only 1 star because every time I go to open the app it either freezes or crashes when loading and it's very annoying plus there are far to many ads in the game. I do not know if this effects of their people but it really annoys me ??,only 1 star because every time i go to open the app it either freezes or crashes when loading and it's very annoying plus there are far to many ads in the game. i do not know if this effects of their people but it really annoys me ??,233,0,1,0,0,0,0,0,1,0,0,0,0,0,0,0,0,0,0,0,0,1,3,1
GB,"You do not have unlimited lives like you used to, you get loads of ads and always crashing! I do not see how the editor would have chosen this unless he was high, drunk or bribed","you do not have unlimited lives like you used to, you get loads of ads and always crashing! i do not see how the editor would have chosen this unless he was high, drunk or bribed",178,0,1,0,0,0,0,0,0,0,0,0,0,0,0,0,0,0,0,0,0,1,2,1
GB,"Disappointed that you have reduced the number of lives from 5 to 3. A further attempt to get more money from in app purchases I presume. Plus, now there are too many adverts. You've ruined a good game.","disappointed that you have reduced the number of lives from 5 to 3. a further attempt to get more money from in app purchases i presume. plus, now there are too many adverts. you've ruined a good game.",201,0,0,0,1,1,0,0,0,0,0,0,1,0,0,0,0,0,0,0,0,0,3,1
GB,Annoyingly will not work when you click to get a free bird by watching a video!,annoyingly will not work when you click to get a free bird by watching a video!,79,0,0,0,0,0,0,0,1,0,0,0,0,0,0,0,0,0,0,0,0,1,2,1
GB,Well it's not that bad...,well it's not that bad...,25,0,0,0,0,1,0,0,0,0,0,0,0,0,0,0,1,0,0,0,0,1,3,1
GB,Good game,good game,9,0,0,0,0,0,0,0,0,0,0,0,0,0,0,0,0,0,0,0,0,0,0,0
GB,"I only get 3 lives, but my partner gets 5!! Why? It's frustrating having to wait so long to have one more go. Stupid!!!","i only get 3 lives, but my partner gets 5!! why? it's frustrating having to wait so long to have one more go. stupid!!!",119,0,0,1,0,0,0,1,0,0,0,0,0,0,0,0,0,0,0,0,0,0,2,1
GB,Best game everrrrr ??????????????,best game everrrrr ??????????????,33,0,0,0,0,0,0,0,0,0,0,0,0,0,0,0,0,0,0,0,0,0,0,0
GB,"Well it's  angrybirds, we love it but it's been completely ruined by lives and silly spell cards, the original is 100 times better than this","well it's  angrybirds, we love it but it's been completely ruined by lives and silly spell cards, the original is 100 times better than this",140,0,0,0,0,0,0,0,0,0,0,0,1,0,0,0,0,0,0,0,0,0,1,1
GB,Gameplay seems quite slow compared to previous angrybirds games. Sure it has great graphics but it's just a mobile game. I'd rather have fun gameplay without all the bloody adverts and requests to sign into Facebook.  The game is purely focused on money. Therefore just charge an upfront fee and be done with. Rovio should be reading these reviews and see they are losing fans.,gameplay seems quite slow compared to previous angrybirds games. sure it has great graphics but it's just a mobile game. i'd rather have fun gameplay without all the bloody adverts and requests to sign into facebook.  the game is purely focused on money. therefore just charge an upfront fee and be done with. rovio should be reading these reviews and see they are losing fans.,377,1,0,0,0,0,0,0,0,0,0,0,0,0,0,0,0,0,0,0,0,0,1,1
GB,I'm just writing this review to make the game makers aware the game keeps crashing sometimes in the middle of a game which can be annoying it also does the same when you level up sort it out game makers then I'll remove my bad review,i'm just writing this review to make the game makers aware the game keeps crashing sometimes in the middle of a game which can be annoying it also does the same when you level up sort it out game makers then i'll remove my bad review,233,0,1,0,0,0,0,0,1,0,0,0,0,0,0,0,1,0,0,0,0,0,3,1
GB,"The original  angrybirds, and all the other spin offs (Star Wars etc) were brilliant. This one is absolutely awful.  The fact you have to pay for more lives says enough in a nutshell. Yes, companies cannot operate without some sort of income, but this game has been built around the philosophy \MAKE MONEY\"". What a shame.  Also, what on earth are those new graphics? They're hideous, what made  angrybirds was the simplicity of it, and the instant loading of levels without all the flash graphics. Now waiting for levels to load and having to watch stupid animations constantly is just irritating.  The fun of  angrybirds came from working out how to do each level. Yes it was frustrating, but the game would not work without the frustration, so everybody enjoyed the feeling when you worked out how to complete a level. Now it is just boring and too jazzed up.   DO NOT DOWNLOAD. RUBBISH.""","the original  angrybirds, and all the other spin offs (star wars etc) were brilliant. this one is absolutely awful.  the fact you have to pay for more lives says enough in a nutshell. yes, companies cannot operate without some sort of income, but this game has been built around the philosophy \make money\"". what a shame.  also, what on earth are those new graphics? they're hideous, what made  angrybirds was the simplicity of it, and the instant loading of levels without all the flash graphics. now waiting for levels to load and having to watch stupid animations constantly is just irritating.  the fun of  angrybirds came from working out how to do each level. yes it was frustrating, but the game would not work without the frustration, so everybody enjoyed the feeling when you worked out how to complete a level. now it is just boring and too jazzed up.   do not download. rubbish.""",891,0,0,1,0,1,0,1,0,1,0,0,0,0,0,0,0,1,0,0,0,1,6,1
GB,I downloaded this game and it looked good but when I started the game itself the game turned off so I went back on the game and again it turned off...,i downloaded this game and it looked good but when i started the game itself the game turned off so i went back on the game and again it turned off...,150,0,0,0,0,0,0,0,0,0,0,0,0,0,0,0,0,0,0,0,0,0,0,0
GB,"Very entertaining, can not keep off it. Brilliant.....","very entertaining, can not keep off it. brilliant.....",54,0,0,0,0,0,0,0,0,0,0,0,0,0,0,0,0,0,0,0,0,1,1,1
GB,"Its worth a download, not the best game I've ever played but a good fun puzzle game.","its worth a download, not the best game i've ever played but a good fun puzzle game.",84,0,0,0,0,0,0,0,0,0,0,0,0,0,0,0,0,0,0,0,0,1,1,1
GB,Since this last update each time I try to start a level the app crashes. Also the original game was better not having so many adverts and not having limited lives. When the game actually works though it's ok.,since this last update each time i try to start a level the app crashes. also the original game was better not having so many adverts and not having limited lives. when the game actually works though it's ok.,208,0,1,0,0,0,0,0,0,0,0,0,0,0,0,0,0,0,0,0,0,1,2,1
GB,Please fix the connection issues to Facebook and remove lives I will rate higher when done,please fix the connection issues to facebook and remove lives i will rate higher when done,90,0,0,0,0,0,0,0,0,0,0,0,0,0,0,0,0,0,0,0,0,0,0,0
GB,Whenever I am about to start a level it crashes,whenever i am about to start a level it crashes,47,0,1,0,0,0,0,0,0,0,0,0,0,0,0,0,0,0,0,0,0,0,1,1
GB,"The resin the original  angrybirds worked is that you could try, try, and try again, and eventually succeed. However Rovio has ruined this concept by adding in gems. And waiting. This has broke the game, and probably is the end for one of the most successful games on the App Store ever, unless this 'feature' is removed from the game!  It is still a good game just broken through greed.","the resin the original  angrybirds worked is that you could try, try, and try again, and eventually succeed. however rovio has ruined this concept by adding in gems. and waiting. this has broke the game, and probably is the end for one of the most successful games on the app store ever, unless this 'feature' is removed from the game!  it is still a good game just broken through greed.",387,1,0,0,0,1,0,1,0,0,0,0,1,0,0,0,0,0,0,0,0,0,4,1
GB,"The latest version has lower the lives we get from 5 to 3, no doubt to stimulate further purchases - cheeky move people!   Feel sorry for the game devs, who have made a really beautiful game, destroyed by greed and business. Sorry guys!","the latest version has lower the lives we get from 5 to 3, no doubt to stimulate further purchases - cheeky move people!   feel sorry for the game devs, who have made a really beautiful game, destroyed by greed and business. sorry guys!",236,0,0,0,0,0,0,0,0,0,0,0,0,0,0,0,0,0,0,0,0,0,0,0
GB,"I've paid for, played and enjoyed  angrybirds on my iPhone for years. An iPad at last I could not wait to get  angrybirds. My previous purchases are not suitable for iPad? So I thought no problem I will be more than willing to purchase the games again, I cannot do anything but fully agree with the previous reviews these games seem to have been revamped for maximum greed on the part of the developer. I do appreciate the amount of work that goes into these games but this is just ridiculous 79.99 best value? Not in my world. I would happily pay a reasonable one off charge for a game that I could play. Sadly now deleted. Sorry that's a no sale. One star because I had to.","i've paid for, played and enjoyed  angrybirds on my iphone for years. an ipad at last i could not wait to get  angrybirds. my previous purchases are not suitable for ipad? so i thought no problem i will be more than willing to purchase the games again, i cannot do anything but fully agree with the previous reviews these games seem to have been revamped for maximum greed on the part of the developer. i do appreciate the amount of work that goes into these games but this is just ridiculous 79.99 best value? not in my world. i would happily pay a reasonable one off charge for a game that i could play. sadly now deleted. sorry that's a no sale. one star because i had to.",677,0,0,0,0,1,0,1,0,0,1,0,0,0,1,0,0,0,0,0,0,1,5,1
GB,It takes ages starting up and logging on! Then when i pressed to go on a level then it crashed and this repeatedly did this. ??????,it takes ages starting up and logging on! then when i pressed to go on a level then it crashed and this repeatedly did this. ??????,131,0,1,0,0,0,0,0,0,0,0,0,0,0,0,0,0,0,0,0,0,0,1,1
GB,The only thing the latest update seems to have changed is that you get more ads.  And I still do not understand the reason for random levels. It removes all incentive to go back and improve your score on a level - unless that's what Rovio want,the only thing the latest update seems to have changed is that you get more ads.  and i still do not understand the reason for random levels. it removes all incentive to go back and improve your score on a level - unless that's what rovio want,243,1,0,0,0,1,0,0,0,0,0,0,0,0,0,0,0,0,0,0,0,1,3,1
GB,Brill as always. Keep comin back for more,brill as always. keep comin back for more,41,0,0,0,0,0,0,0,0,0,0,0,0,0,0,0,0,0,0,0,0,0,0,0
GB,Oh my gosh! Frustrating is a word for it! Keeps on saying internet connection failed when I'm in full wifi signal. DELETED!,oh my gosh! frustrating is a word for it! keeps on saying internet connection failed when i'm in full wifi signal. deleted!,123,0,0,1,0,0,0,0,0,0,0,0,0,0,1,0,0,0,0,0,0,0,2,1
GB,Excellent,excellent,9,0,0,0,0,0,0,0,0,0,0,0,0,0,0,0,0,0,0,0,0,0,0,0
GB,"This game can actually be good but when you get to level 26 the game crashes and goes off, throughout the game there can be a lot of crashes but the worst is when you do get to level 26 because you click the level press play and the it will load, the loading screen turns black and then it just goes off every time","this game can actually be good but when you get to level 26 the game crashes and goes off, throughout the game there can be a lot of crashes but the worst is when you do get to level 26 because you click the level press play and the it will load, the loading screen turns black and then it just goes off every time",314,0,1,0,0,0,0,0,0,0,0,0,0,0,0,0,0,0,0,0,0,0,1,1
GB,I love it. It so much fun!,i love it. it so much fun!,26,0,0,0,0,0,0,0,0,0,0,0,0,0,0,0,0,0,0,0,0,0,0,0
GB,Great fun.. I actually love this new version of a cracking classic :),great fun.. i actually love this new version of a cracking classic :),69,0,0,0,0,0,0,0,0,0,0,0,0,0,0,0,0,0,0,0,0,0,0,0
GB,Feels better than 1,feels better than 1,19,0,0,0,0,0,0,0,0,0,0,0,0,0,0,0,0,0,0,0,0,0,0,0
GB,"Iv bought and played every single  angrybirds so far and loved them but  angrybirds 2 is crap, brought lives into it, so u can not just keep playing, graphics different, nothing like the other  angrybirds games, why change when it was so good, spoilt it!","iv bought and played every single  angrybirds so far and loved them but  angrybirds 2 is crap, brought lives into it, so u can not just keep playing, graphics different, nothing like the other  angrybirds games, why change when it was so good, spoilt it!",254,0,0,0,0,0,0,0,0,0,0,0,0,0,0,0,0,0,0,0,1,1,2,1
GB,More or less it is the same except improved graphics and some tweaks here and there.   Relatively easy but became boring very quickly.  The arena and daily challenges are not gripping enough to pull me back everyday...neither is the storyline.   I have now deleted the app,more or less it is the same except improved graphics and some tweaks here and there.   relatively easy but became boring very quickly.  the arena and daily challenges are not gripping enough to pull me back everyday...neither is the storyline.   i have now deleted the app,272,0,0,0,0,0,0,0,0,0,0,0,0,0,1,0,0,0,0,0,0,1,2,1
GB,This game is very addictive and lots of fun and I really love the new animations.,this game is very addictive and lots of fun and i really love the new animations.,81,0,0,0,0,0,0,0,0,0,0,0,0,0,0,0,0,0,0,0,0,0,0,0
