Country,Comments,lower_comments,character,rovio,crash,frustrat,disapp,hat,n't,wait,annoy,sham,proble,waste,ruin,terrible,delet,uninstall,bad,rubbish,garbage,junk,crap,not,sum_1,negative
US,"Are the lives REALLY necessary? I mean, I would buy the game for $5 and happily play without lives. Plus, there are ads every couple minutes. Also, I remember when lives took more than half of the current time to regenerate! I find this game fun but you never even really get to play in the first place. I would HAPPILY pay $5 for this game.","are the lives really necessary? i mean, i would buy the game for $5 and happily play without lives. plus, there are ads every couple minutes. also, i remember when lives took more than half of the current time to regenerate! i find this game fun but you never even really get to play in the first place. i would happily pay $5 for this game.",341,0,0,0,0,0,0,0,0,0,0,0,0,0,0,0,0,0,0,0,0,0,0,0
US,It's a greAt game,it's a great game,17,0,0,0,0,0,0,0,0,0,0,0,0,0,0,0,0,0,0,0,0,0,0,0
US,"do not bother with this game, plain and simple.  Ever since the latest update the game is unplayable due to the bugs.  The game will load up to the level map, but crash as soon as you select a level to play.","do not bother with this game, plain and simple.  ever since the latest update the game is unplayable due to the bugs.  the game will load up to the level map, but crash as soon as you select a level to play.",207,0,1,0,0,0,0,0,0,0,0,0,0,0,0,0,0,0,0,0,0,1,2,1
US,Fun and addicting!,fun and addicting!,18,0,0,0,0,0,0,0,0,0,0,0,0,0,0,0,0,0,0,0,0,0,0,0
US,Pay to play. Enough said.,pay to play. enough said.,25,0,0,0,0,0,0,0,0,0,0,0,0,0,0,0,0,0,0,0,0,0,0,0
US,It keeps crashing before I can even play the first level.,it keeps crashing before i can even play the first level.,57,0,1,0,0,0,0,0,0,0,0,0,0,0,0,0,0,0,0,0,0,0,1,1
US,"Since the original  angrybirds released, I've seen the devs add more and more content to make you pay. I've always been able to avoid these since I had paid for the game. With  angrybirds 2, you get to a point where you can choose to wait 25 minutes or pay 75 cents for 1 more shot at beating the level. Take my advise and pass on this one.","since the original  angrybirds released, i've seen the devs add more and more content to make you pay. i've always been able to avoid these since i had paid for the game. with  angrybirds 2, you get to a point where you can choose to wait 25 minutes or pay 75 cents for 1 more shot at beating the level. take my advise and pass on this one.",340,0,0,0,0,0,0,1,0,0,0,0,0,0,0,0,0,0,0,0,0,0,1,1
US,Just bigger and better in every way than the first  angrybirds that came out!,just bigger and better in every way than the first  angrybirds that came out!,77,0,0,0,0,1,0,0,0,0,0,0,0,0,0,0,0,0,0,0,0,0,1,1
US,Pay as you go...which between ads and continual crashing issues has ruined what was once one of my favorite games to play.  60 GEMS per life and/or birds?  Seriously?  I have tried 5 times to play this today.  Forced to watch an ad to double my gems (ring a ding which amounts to only 3) each time I've tried to play and it crashes and takes me back to my IPad screen.  Not worth the aggravation to play and wait in game play hell to actually refill a life.  I will just play the older versions that were not nickel and dimming me with payments and/or annoying ads.  Rock on without me Rovio.... At least for this disappointing game..,pay as you go...which between ads and continual crashing issues has ruined what was once one of my favorite games to play.  60 gems per life and/or birds?  seriously?  i have tried 5 times to play this today.  forced to watch an ad to double my gems (ring a ding which amounts to only 3) each time i've tried to play and it crashes and takes me back to my ipad screen.  not worth the aggravation to play and wait in game play hell to actually refill a life.  i will just play the older versions that were not nickel and dimming me with payments and/or annoying ads.  rock on without me rovio.... at least for this disappointing game..,634,1,1,0,1,1,0,1,1,0,0,0,1,0,0,0,0,0,0,0,0,1,8,1
US,It crashes every time I try to play.,it crashes every time i try to play.,36,0,1,0,0,0,0,0,0,0,0,0,0,0,0,0,0,0,0,0,0,0,1,1
US,"I truly hope they do not ditch updates on the original series of  angrybirds. yeah, the graphics are cool, but the play is not as challenging, and I can not get into the spells or cards aspect of it all","i truly hope they do not ditch updates on the original series of  angrybirds. yeah, the graphics are cool, but the play is not as challenging, and i can not get into the spells or cards aspect of it all",202,0,0,0,0,0,0,0,0,0,0,0,0,0,0,0,0,0,0,0,0,1,1,1
US,Paying for lives now?  And now after the update the number of lives was reduced to 3?,paying for lives now?  and now after the update the number of lives was reduced to 3?,85,0,0,0,0,0,0,0,0,0,0,0,0,0,0,0,0,0,0,0,0,0,0,0
US,can not really stop once you start!,can not really stop once you start!,35,0,0,0,0,0,0,0,0,0,0,0,0,0,0,0,0,0,0,0,0,1,1,1
US,"Terrible disappointment. Awful game play experience and the exact opposite of the original. In the original it was problem solving and getting the right angle to form a solution, now you can not take the time or the extra tries. You have limited lives unless you pay up.  Quiet sad actually. Guess the bean counters replaced the game designers.  will not see a nickel from me. Had they simply sold the app for few bucks it would be one thing. Getting bled every time you play? Not happening","terrible disappointment. awful game play experience and the exact opposite of the original. in the original it was problem solving and getting the right angle to form a solution, now you can not take the time or the extra tries. you have limited lives unless you pay up.  quiet sad actually. guess the bean counters replaced the game designers.  will not see a nickel from me. had they simply sold the app for few bucks it would be one thing. getting bled every time you play? not happening",490,0,0,0,1,0,0,0,0,0,1,0,0,1,0,0,0,0,0,0,0,1,4,1
US,"I really like playing  angrybirds in my spare time and I feel like this game has the potential to be the best game so far in the  angrybirds series. I really like what Rovio has done, except for the fact that the game is almost ruined due to the fact that your lives are limited and you must wait a few hours for them to come back. Or be forced to buy more. I understand the being a business they need to make money but I would much rather pay let's say $4.99 than be stuck with an awesome game I can not play","i really like playing  angrybirds in my spare time and i feel like this game has the potential to be the best game so far in the  angrybirds series. i really like what rovio has done, except for the fact that the game is almost ruined due to the fact that your lives are limited and you must wait a few hours for them to come back. or be forced to buy more. i understand the being a business they need to make money but i would much rather pay let's say $4.99 than be stuck with an awesome game i can not play",509,1,0,0,0,1,0,1,0,0,0,0,1,0,0,0,0,0,0,0,0,1,5,1
US,"Love the graphics, wish it did not have the whole purchase gems thing and the lives. I get why they are doing it. I just feel if it is not broke do not fix it!","love the graphics, wish it did not have the whole purchase gems thing and the lives. i get why they are doing it. i just feel if it is not broke do not fix it!",159,0,0,0,0,0,0,0,0,0,0,0,0,0,0,0,0,0,0,0,0,1,1,1
US,I'm sorry for Rovno . My kid loves  angrybirds . Installed every game they had . I installed AngryBirds2 for him as a gift . I was ready to spend some dollars inside ... But the game never runs ... Every time it says no internet connection . But iPad is connected with good speed . Waited for new upgrade to solve the issue but nothing happened. Wish they had more support .,i'm sorry for rovno . my kid loves  angrybirds . installed every game they had . i installed angrybirds2 for him as a gift . i was ready to spend some dollars inside ... but the game never runs ... every time it says no internet connection . but ipad is connected with good speed . waited for new upgrade to solve the issue but nothing happened. wish they had more support .,374,0,0,0,0,0,0,1,0,0,0,0,0,0,0,0,0,0,0,0,0,1,2,1
US,"Fun game, well thought out, great graphics. Now the bad ...give five turns at a time and the path to spending lots of money. The beginning is easy, but as time goes on it will become frustrating to get three stars. It is like King games and that is not a compliment. I miss the old days of angrybirds...with Rio going by coins and now this...the last of the great games. I will play for awhile and then delete it like I finally after years with Rio.","fun game, well thought out, great graphics. now the bad ...give five turns at a time and the path to spending lots of money. the beginning is easy, but as time goes on it will become frustrating to get three stars. it is like king games and that is not a compliment. i miss the old days of angrybirds...with rio going by coins and now this...the last of the great games. i will play for awhile and then delete it like i finally after years with rio.",449,0,0,1,0,1,0,0,0,0,0,0,0,0,1,0,1,0,0,0,0,1,5,1
US,Feels a little to much pay to win,feels a little to much pay to win,33,0,0,0,0,0,0,0,0,0,0,0,0,0,0,0,0,0,0,0,0,0,0,0
US,"It's unreal how companies have shifted to making games not fun anymore. It's all about how many ads can we display and how much money can we make. This game is absolutely no different! At times it feels that with the \random\"" bird layouts each level are designed to cause you to fail so you have no choice but to pay for more lives if you want to continue playing. They incorporated pigs attached to balloons that fly around therefore you'll more than likely have to waste 1 bird of your limited stock just to get that one pig! It's ridiculous!""","it's unreal how companies have shifted to making games not fun anymore. it's all about how many ads can we display and how much money can we make. this game is absolutely no different! at times it feels that with the \random\"" bird layouts each level are designed to cause you to fail so you have no choice but to pay for more lives if you want to continue playing. they incorporated pigs attached to balloons that fly around therefore you'll more than likely have to waste 1 bird of your limited stock just to get that one pig! it's ridiculous!""",546,0,0,0,0,1,0,0,0,0,0,1,0,0,0,0,0,0,0,0,0,1,3,1
US,This game is awesome,this game is awesome,20,0,0,0,0,0,0,0,0,0,0,0,0,0,0,0,0,0,0,0,0,0,0,0
US,Very good game!,very good game!,15,0,0,0,0,0,0,0,0,0,0,0,0,0,0,0,0,0,0,0,0,0,0,0
US,"They actually made a better game here but then I ran out of lives... I've paid upfront for premium versions of Rovio games but I refuse to get sucked into the freemium model. Rovio, you let bad business ruin your best game yet.","they actually made a better game here but then i ran out of lives... i've paid upfront for premium versions of rovio games but i refuse to get sucked into the freemium model. rovio, you let bad business ruin your best game yet.",227,1,0,0,0,0,0,0,0,0,0,0,1,0,0,0,1,0,0,0,0,0,3,1
US,Kind of annoying that it costs more than 1 heart to continue. But they give you free hearts for watching videos,kind of annoying that it costs more than 1 heart to continue. but they give you free hearts for watching videos,111,0,0,0,0,1,0,0,1,0,0,0,0,0,0,0,0,0,0,0,0,0,2,1
US,"If the game was 3 dollars,everyone would get it,and the creators would still get millions.But no,it's another game of war sponcering,candy crush live based piece of crap.who falls for this?","if the game was 3 dollars,everyone would get it,and the creators would still get millions.but no,it's another game of war sponcering,candy crush live based piece of crap.who falls for this?",189,0,0,0,0,0,0,0,0,0,0,0,0,0,0,0,0,0,0,0,1,1,2,1
US,"I agree with other reviewers about too many ads, reduction from 5 to 3 lives, having \lives\"" at all, and random board designs. Key elements from original are gone.""","i agree with other reviewers about too many ads, reduction from 5 to 3 lives, having \lives\"" at all, and random board designs. key elements from original are gone.""",165,0,0,0,0,0,0,0,0,0,0,0,0,0,0,0,0,0,0,0,0,0,0,0
US,Soundcloud.com/sensethabeast,soundcloud.com/sensethabeast,28,0,0,0,0,0,0,0,0,0,0,0,0,0,0,0,0,0,0,0,0,0,0,0
US,"Why? Why, why, why?  Why the lives? Was it not enough we already had ads and optional videos to watch in the others? We clicked. We watched.  Now you get 3 tries and then you can wait. Ugh.  Also gone is the retry option and several others (like the ability to see what each bird does...).  Super disappointing.","why? why, why, why?  why the lives? was it not enough we already had ads and optional videos to watch in the others? we clicked. we watched.  now you get 3 tries and then you can wait. ugh.  also gone is the retry option and several others (like the ability to see what each bird does...).  super disappointing.",311,0,0,0,1,1,0,1,0,0,0,0,0,0,0,0,0,0,0,0,0,1,4,1
US,"FYI... 3-starred every level up to the recent update and will probably be calling it quits due to the recent changes and I'm no willing to support their business decisions any longer.  Echoing many of the other reviews on here, the micro transactions and waiting to play can be quite aggravating. I can get over those, though. What disappoints me most about this sequel is the trial and error skills they promoted so heavily in versions past are all but gone.  1 - the starting order of your birds is never the same: this eliminates the strategy of being able to use the birds to the best of their abilities against whatever towers are in a level's section.  2 - the sections within each level are never the same: the general shape and locations of the towers are close and fall within whatever parameters Rovio has decided to implement.   3 - the pigs in the level are never the same: one will float out of harm's way initially; one will throw things at you making your bird go off course; one will turn your bird into something useless; there are others (and they are apparently going to keep adding more if the recent update is any indication).  I'm sad that it had to be this way.","fyi... 3-starred every level up to the recent update and will probably be calling it quits due to the recent changes and i'm no willing to support their business decisions any longer.  echoing many of the other reviews on here, the micro transactions and waiting to play can be quite aggravating. i can get over those, though. what disappoints me most about this sequel is the trial and error skills they promoted so heavily in versions past are all but gone.  1 - the starting order of your birds is never the same: this eliminates the strategy of being able to use the birds to the best of their abilities against whatever towers are in a level's section.  2 - the sections within each level are never the same: the general shape and locations of the towers are close and fall within whatever parameters rovio has decided to implement.   3 - the pigs in the level are never the same: one will float out of harm's way initially; one will throw things at you making your bird go off course; one will turn your bird into something useless; there are others (and they are apparently going to keep adding more if the recent update is any indication).  i'm sad that it had to be this way.",1184,1,0,0,1,1,0,1,0,0,0,0,0,0,0,0,0,0,0,0,0,0,4,1
US,NOW!!!,now!!!,6,0,0,0,0,0,0,0,0,0,0,0,0,0,0,0,0,0,0,0,0,0,0,0
US,The games keeps crashing on me for the last few days. Had to delete and reload and now have to start over at level 1. Still crashing even at that level. Not happy.,the games keeps crashing on me for the last few days. had to delete and reload and now have to start over at level 1. still crashing even at that level. not happy.,163,0,1,0,0,1,0,0,0,0,0,0,0,0,1,0,0,0,0,0,0,1,4,1
US,"Remember when you got to play and had 5 lives to start and a 30min before life refresh? Yeah, forget that.  Now it's 3 lives and 1hr before refresh!  Add in an increased need for gems and a high purchase price and Rovio just lost its fan base!   Adding to the fun, the game would only start 1/4 of the time...if at all.  Negative stars would be nice!","remember when you got to play and had 5 lives to start and a 30min before life refresh? yeah, forget that.  now it's 3 lives and 1hr before refresh!  add in an increased need for gems and a high purchase price and rovio just lost its fan base!   adding to the fun, the game would only start 1/4 of the time...if at all.  negative stars would be nice!",350,1,0,0,0,1,0,0,0,0,0,0,0,0,0,0,0,0,0,0,0,0,2,1
US,"I enjoy playing  angrybirds, but since the recent update, I know have to wait an hour until my lives replenish! Why did you take the 5 lives out! Very disappointed.","i enjoy playing  angrybirds, but since the recent update, i know have to wait an hour until my lives replenish! why did you take the 5 lives out! very disappointed.",164,0,0,0,1,0,0,1,0,0,0,0,0,0,0,0,0,0,0,0,0,0,2,1
US,"I enjoyed playing when the game was released. But like so many others, Rovio has become too big for their britches and the greed is disgusting.    With the last downgrade, we went from 5 lives to 3. The time to get those back seems to have increased by 50%. Personally, I'll now be deleting this and not downloading any more Rovio hijackings ....I mean games.","i enjoyed playing when the game was released. but like so many others, rovio has become too big for their britches and the greed is disgusting.    with the last downgrade, we went from 5 lives to 3. the time to get those back seems to have increased by 50%. personally, i'll now be deleting this and not downloading any more rovio hijackings ....i mean games.",359,1,0,0,0,0,0,0,0,0,0,0,0,0,1,0,0,0,0,0,0,1,3,1
US,The game mechanics themselves are great and it looks amazing but the lives system and the constant pestering to watch videos ruin the fun of it.  You have to wait 30 mins to regain each individual life.  You're punished for the same behavior that made the previous games fun.,the game mechanics themselves are great and it looks amazing but the lives system and the constant pestering to watch videos ruin the fun of it.  you have to wait 30 mins to regain each individual life.  you're punished for the same behavior that made the previous games fun.,275,0,0,0,0,1,0,1,0,0,0,0,1,0,0,0,0,0,0,0,0,0,3,1
US,"I understand you want money, but at the expense of you long term customers? Every body loved re trying so they could get the perfect score, but now the games just a waste of time. Allow me to rate 1 star before uninstalling this mistake of a game","i understand you want money, but at the expense of you long term customers? every body loved re trying so they could get the perfect score, but now the games just a waste of time. allow me to rate 1 star before uninstalling this mistake of a game",246,0,0,0,0,0,0,0,0,0,0,1,0,0,0,1,0,0,0,0,0,0,2,1
US,Yes!!!!,yes!!!!,7,0,0,0,0,0,0,0,0,0,0,0,0,0,0,0,0,0,0,0,0,0,0,0
US,Woot,woot,4,0,0,0,0,0,0,0,0,0,0,0,0,0,0,0,0,0,0,0,0,0,0,0
US,It's funnier yet angrier then before!,it's funnier yet angrier then before!,37,0,0,0,0,0,0,0,0,0,0,0,0,0,0,0,0,0,0,0,0,0,0,0
US,"I remember when  angrybirds only cost one dollar. Now it's free, and frankly, terrible. With all the money you would spend to get the same quality as the original (lives, power-ups, ect.), you could just buy the first game- twenty times. This game just has the same formula that all the other \puzzle\"" games have, except now, there were much higher expectations. Thanks, Rovio.""","i remember when  angrybirds only cost one dollar. now it's free, and frankly, terrible. with all the money you would spend to get the same quality as the original (lives, power-ups, ect.), you could just buy the first game- twenty times. this game just has the same formula that all the other \puzzle\"" games have, except now, there were much higher expectations. thanks, rovio.""",379,1,0,0,0,1,0,0,0,0,0,0,0,1,0,0,0,0,0,0,0,0,3,1
US,"It used to be a really fun game. It was even kind of acceptable when you had 5 free lives at full health, but now that they've changed it and give 3 lives now. All they want is your money and they do not care if they lose popularity over it, even though that's just a poor business plan.","it used to be a really fun game. it was even kind of acceptable when you had 5 free lives at full health, but now that they've changed it and give 3 lives now. all they want is your money and they do not care if they lose popularity over it, even though that's just a poor business plan.",287,0,0,0,0,1,0,0,0,0,0,0,0,0,0,0,0,0,0,0,0,1,2,1
US,could not just stick with the basics that have worked for years and made you millions. Last time I will download anything from Rovio or  angrybirds.,could not just stick with the basics that have worked for years and made you millions. last time i will download anything from rovio or  angrybirds.,148,1,0,0,0,1,0,0,0,0,0,0,0,0,0,0,0,0,0,0,0,1,3,1
US,"Came back to angrybirds since rio version, plus wanted a game to play for several minutes at a time. But deleted this game now with the introduction of YouTube like video ads. How greedy can you be with in-app purchases already?","came back to angrybirds since rio version, plus wanted a game to play for several minutes at a time. but deleted this game now with the introduction of youtube like video ads. how greedy can you be with in-app purchases already?",228,0,0,0,0,0,0,0,0,0,0,0,0,0,1,0,0,0,0,0,0,0,1,1
US,"With the latest update you only get 3 lives, not 5. Also the levels have become harder forcing the use of spell cards. Rovio is so obsessed with making money they have lost sight of what made  angrybirds fun. So sad...","with the latest update you only get 3 lives, not 5. also the levels have become harder forcing the use of spell cards. rovio is so obsessed with making money they have lost sight of what made  angrybirds fun. so sad...",218,1,0,0,0,1,0,0,0,0,0,0,0,0,0,0,0,0,0,0,0,1,3,1
US,"I love the  angrybirds series and was excited with the intro of  angrybirds 2 but once I started playing it I had a bad feeling about it... Limited play, paying for everything, AND when I actually have time to relax and play it will not load.  This game gets an F","i love the  angrybirds series and was excited with the intro of  angrybirds 2 but once i started playing it i had a bad feeling about it... limited play, paying for everything, and when i actually have time to relax and play it will not load.  this game gets an f",263,0,0,0,0,0,0,0,0,0,0,0,0,0,0,0,1,0,0,0,0,1,2,1
US,There was recently an update.. Now instead of having 10 lives you only have 5.... Money hungry. I will not be paying a dime. I'll just wait.,there was recently an update.. now instead of having 10 lives you only have 5.... money hungry. i will not be paying a dime. i'll just wait.,140,0,0,0,0,0,0,1,0,0,0,0,0,0,0,0,0,0,0,0,0,1,2,1
US,Too many ads! way too many! What happened to the days when you could just play the game! Going back to clash of the clans !,too many ads! way too many! what happened to the days when you could just play the game! going back to clash of the clans !,123,0,0,0,0,1,0,0,0,0,0,0,0,0,0,0,0,0,0,0,0,0,1,1
US,Every time I play a level the game keeps kicking me out. Fix the game please.,every time i play a level the game keeps kicking me out. fix the game please.,77,0,0,0,0,0,0,0,0,0,0,0,0,0,0,0,0,0,0,0,0,0,0,0
US,In the first it had not have a lot but in the 2 I love it I'm not a pro but I love it. :),in the first it had not have a lot but in the 2 i love it i'm not a pro but i love it. :),89,0,0,0,0,0,0,0,0,0,0,0,0,0,0,0,0,0,0,0,0,1,1,1
US,I like the original  angrybirds better then this one...it's all about money on this one...the create levels that you can not pass so end up spending money to get through it...,i like the original  angrybirds better then this one...it's all about money on this one...the create levels that you can not pass so end up spending money to get through it...,175,0,0,0,0,1,0,0,0,0,0,0,0,0,0,0,0,0,0,0,0,1,2,1
US,"Graphics are cool, but I'm deleting this game because of the \pay to win\"" pricing structure. You want us to pay REAL money for digital gems? Soooooooo dumb. Shame on  angrybirds for showing their greed.""","graphics are cool, but i'm deleting this game because of the \pay to win\"" pricing structure. you want us to pay real money for digital gems? soooooooo dumb. shame on  angrybirds for showing their greed.""",204,0,0,0,0,0,0,0,0,1,0,0,0,0,1,0,0,0,0,0,0,0,2,1
US,There was nothing wrong with the old format. Why change it? I've had this version since day one and you had 5 lives and now only 3? Are you trying to push people away? Cmon.,there was nothing wrong with the old format. why change it? i've had this version since day one and you had 5 lives and now only 3? are you trying to push people away? cmon.,173,0,0,0,0,0,0,0,0,0,0,0,0,0,0,0,0,0,0,0,0,1,1,1
US,The original game got really old pretty fast. So I never plaid any of the sequel games. But this one is pretty good. has not gotten old yet,the original game got really old pretty fast. so i never plaid any of the sequel games. but this one is pretty good. has not gotten old yet,139,0,0,0,0,0,0,0,0,0,0,0,0,0,0,0,0,0,0,0,0,1,1,1
US,"Great game!  BEFORE THE UPDATE! screw Rovio, I am deleting the game now.","great game!  before the update! screw rovio, i am deleting the game now.",72,1,0,0,0,0,0,0,0,0,0,0,0,0,1,0,0,0,0,0,0,0,2,1
